{
  "schema": "app-dna-v1",
  "app_id": "demo",
  "created_at": "2026-08-04T04:00:00.000Z",
  "mode": "certified",
  "parent_hash": null,
  "routes": [
    {
      "host": "127.0.0.1",
      "method": "GET",
      "path_template": "/api/health",
      "content_class": "json",
      "status_classes": [200],
      "response_key_fingerprint": "ok,service"
    },
    {
      "host": "127.0.0.1",
      "method": "GET",
      "path_template": "/api/items",
      "content_class": "json",
      "status_classes": [200],
      "response_key_fingerprint": "items"
    }
  ],
  "holes": []
}
